,title,title_detail,links,link,summary,summary_detail,id,guidislink,published,published_parsed,authors,author,author_detail
4,"Ricardo Arriazu: ""En la Argentina es siempre 'qué me da'; la política es un ascenso social y el Estado es un botín""","{'type': 'text/plain', 'language': None, 'base': 'https://www.clarin.com/rss/economia/', 'value': 'Ricardo Arriazu: ""En la Argentina es siempre \'qué me da\'; la política es un ascenso social y el Estado es un botín""'}","[{'rel': 'alternate', 'type': 'text/html', 'href': 'http://www.clarin.com/economia/economia/economista-cuestiono-estimulo-consumo-solucion_0_O3gctH8vE.html'}, {'length': '0', 'type': 'image/jpg', 'href': 'https://images.clarin.com/2019/05/08/goEbbiSoe_600x338__1.jpg', 'rel': 'enclosure'}]",http://www.clarin.com/economia/economia/economista-cuestiono-estimulo-consumo-solucion_0_O3gctH8vE.html,El economista trazó un panorama crítico que excede al actual gobierno y afirmó que si el país no realiza cambios estructurales no saldrá de la crisis.,"{'type': 'text/html', 'language': None, 'base': 'https://www.clarin.com/rss/economia/', 'value': 'El economista trazó un panorama crítico que excede al actual gobierno y afirmó que si el país no realiza cambios estructurales no saldrá de la crisis.'}",http://www.clarin.com/economia/economia/economista-cuestiono-estimulo-consumo-solucion_0_O3gctH8vE.html,False,"Wed, 04 Sep 2019 11:35:07 -0300","time.struct_time(tm_year=2019, tm_mon=9, tm_mday=4, tm_hour=14, tm_min=35, tm_sec=7, tm_wday=2, tm_yday=247, tm_isdst=0)",[{'name': 'Clarin.com'}],Clarin.com,{'name': 'Clarin.com'}
5,Dólar hoy: se mantiene estable y baja el riesgo país por primera vez en 9 días,"{'type': 'text/plain', 'language': None, 'base': 'https://www.clarin.com/rss/economia/', 'value': 'Dólar hoy: se mantiene estable y baja el riesgo país por primera vez en 9 días'}","[{'rel': 'alternate', 'type': 'text/html', 'href': 'http://www.clarin.com/economia/economia/dolar-hoy-mantiene-estable-baja-riesgo-pais-primera-vez-9-dias_0_V36Ye9SDT.html'}, {'length': '0', 'type': 'image/jpg', 'href': 'https://images.clarin.com/2019/09/03/jW1XoAFSv_600x338__1.jpg', 'rel': 'enclosure'}]",http://www.clarin.com/economia/economia/dolar-hoy-mantiene-estable-baja-riesgo-pais-primera-vez-9-dias_0_V36Ye9SDT.html,Cotiza a $ 57 en el Banco Nación. El riesgo baja de los 2.400 puntos básicos.,"{'type': 'text/html', 'language': None, 'base': 'https://www.clarin.com/rss/economia/', 'value': 'Cotiza a $ 57 en el Banco Nación. El riesgo baja de los 2.400 puntos básicos.'}",http://www.clarin.com/economia/economia/dolar-hoy-mantiene-estable-baja-riesgo-pais-primera-vez-9-dias_0_V36Ye9SDT.html,False,"Wed, 04 Sep 2019 10:46:29 -0300","time.struct_time(tm_year=2019, tm_mon=9, tm_mday=4, tm_hour=13, tm_min=46, tm_sec=29, tm_wday=2, tm_yday=247, tm_isdst=0)",[{'name': 'Clarin.com'}],Clarin.com,{'name': 'Clarin.com'}
6,AEA se sumó al pedido de un acuerdo político y social,"{'type': 'text/plain', 'language': None, 'base': 'https://www.clarin.com/rss/economia/', 'value': 'AEA se sumó al pedido de un acuerdo político y social'}","[{'rel': 'alternate', 'type': 'text/html', 'href': 'http://www.clarin.com/economia/economia/aea-sumo-pedido-acuerdo-politico-social_0_hlsj98VE6.html'}, {'length': '0', 'type': 'image/jpg', 'href': 'https://images.clarin.com/2018/03/23/S1zrBpB5G_600x338__1.jpg', 'rel': 'enclosure'}]",http://www.clarin.com/economia/economia/aea-sumo-pedido-acuerdo-politico-social_0_hlsj98VE6.html,El titular de la Asociación Empresaria Argentina llamó a evitar los atajos.,"{'type': 'text/html', 'language': None, 'base': 'https://www.clarin.com/rss/economia/', 'value': 'El titular de la Asociación Empresaria Argentina llamó a evitar los atajos.'}",http://www.clarin.com/economia/economia/aea-sumo-pedido-acuerdo-politico-social_0_hlsj98VE6.html,False,"Wed, 04 Sep 2019 10:26:32 -0300","time.struct_time(tm_year=2019, tm_mon=9, tm_mday=4, tm_hour=13, tm_min=26, tm_sec=32, tm_wday=2, tm_yday=247, tm_isdst=0)",[{'name': 'Clarin.com'}],Clarin.com,{'name': 'Clarin.com'}
7,"Tras la prueba piloto, YPF empieza a exportar gas por barco de manera regular","{'type': 'text/plain', 'language': None, 'base': 'https://www.clarin.com/rss/economia/', 'value': 'Tras la prueba piloto, YPF empieza a exportar gas por barco de manera regular'}","[{'rel': 'alternate', 'type': 'text/html', 'href': 'http://www.clarin.com/economia/economia/prueba-piloto-ypf-empieza-exportar-gas-barco-manera-regular_0_MZ5KbRW_I.html'}, {'length': '0', 'type': 'image/jpg', 'href': 'https://images.clarin.com/2019/09/04/22k5FBAzA_600x338__1.jpg', 'rel': 'enclosure'}]",http://www.clarin.com/economia/economia/prueba-piloto-ypf-empieza-exportar-gas-barco-manera-regular_0_MZ5KbRW_I.html,Sumará US$ 200 millones en exportaciones por año. Enviará el gas de Vaca Muerta entre septiembre y mayo.,"{'type': 'text/html', 'language': None, 'base': 'https://www.clarin.com/rss/economia/', 'value': 'Sumará US$ 200 millones en exportaciones por año. Enviará el gas de Vaca Muerta entre septiembre y mayo.'}",http://www.clarin.com/economia/economia/prueba-piloto-ypf-empieza-exportar-gas-barco-manera-regular_0_MZ5KbRW_I.html,False,"Wed, 04 Sep 2019 09:33:59 -0300","time.struct_time(tm_year=2019, tm_mon=9, tm_mday=4, tm_hour=12, tm_min=33, tm_sec=59, tm_wday=2, tm_yday=247, tm_isdst=0)",[{'name': 'Clarin.com'}],Clarin.com,{'name': 'Clarin.com'}
8,Video: Aurelius Capital dice que la crisis argentina incrementa el daño económico por el litigio del Cupón PBI,"{'type': 'text/plain', 'language': None, 'base': 'https://www.clarin.com/rss/economia/', 'value': 'Video: Aurelius Capital dice que la crisis argentina incrementa el daño económico por el litigio del Cupón PBI'}","[{'rel': 'alternate', 'type': 'text/html', 'href': 'http://www.clarin.com/economia/video-aurelius-capital-dice-crisis-argentina-incrementa-dano-economico-litigio-cupon-pbi_0_4yLSAeZfW.html'}, {'length': '0', 'type': 'image/jpg', 'href': 'https://images.clarin.com/2019/09/04/IXn6ZrdUp_600x338__1.jpg', 'rel': 'enclosure'}]",http://www.clarin.com/economia/video-aurelius-capital-dice-crisis-argentina-incrementa-dano-economico-litigio-cupon-pbi_0_4yLSAeZfW.html,FIN.GURU te acerca los principales temas económicos para comenzar la jornada de este miércoles.,"{'type': 'text/html', 'language': None, 'base': 'https://www.clarin.com/rss/economia/', 'value': 'FIN.GURU te acerca los principales temas económicos para comenzar la jornada de este miércoles.'}",http://www.clarin.com/economia/video-aurelius-capital-dice-crisis-argentina-incrementa-dano-economico-litigio-cupon-pbi_0_4yLSAeZfW.html,False,"Wed, 04 Sep 2019 07:13:51 -0300","time.struct_time(tm_year=2019, tm_mon=9, tm_mday=4, tm_hour=10, tm_min=13, tm_sec=51, tm_wday=2, tm_yday=247, tm_isdst=0)",[{'name': 'Clarin.com'}],Clarin.com,{'name': 'Clarin.com'}
9,Boletín oficial: se confirmó la postergación del aumento en la tarifa de gas,"{'type': 'text/plain', 'language': None, 'base': 'https://www.clarin.com/rss/economia/', 'value': 'Boletín oficial: se confirmó la postergación del aumento en la tarifa de gas'}","[{'rel': 'alternate', 'type': 'text/html', 'href': 'http://www.clarin.com/economia/boletin-oficial-confirmo-postergacion-aumento-tarifa-gas_0_mDHgQyE7H.html'}, {'length': '0', 'type': 'image/jpg', 'href': 'https://images.clarin.com/2019/03/28/wfaKmdjpk_600x338__1.jpg', 'rel': 'enclosure'}]",http://www.clarin.com/economia/boletin-oficial-confirmo-postergacion-aumento-tarifa-gas_0_mDHgQyE7H.html,"El ajuste, que debía regir desde octubre, se hará en enero. Las prestadoras readecuarán su plan de inversiones.","{'type': 'text/html', 'language': None, 'base': 'https://www.clarin.com/rss/economia/', 'value': 'El ajuste, que debía regir desde octubre, se hará en enero. Las prestadoras readecuarán su plan de inversiones.'}",http://www.clarin.com/economia/boletin-oficial-confirmo-postergacion-aumento-tarifa-gas_0_mDHgQyE7H.html,False,"Wed, 04 Sep 2019 03:15:25 -0300","time.struct_time(tm_year=2019, tm_mon=9, tm_mday=4, tm_hour=6, tm_min=15, tm_sec=25, tm_wday=2, tm_yday=247, tm_isdst=0)",[{'name': 'Clarin.com'}],Clarin.com,{'name': 'Clarin.com'}
