,title,title_detail,links,link,summary,summary_detail,id,guidislink,published,published_parsed,authors,author,author_detail
7,Alberto Fernández en España: la convivencia PJ-La Cámpora y el pedido de la jefa del Santander,"{'type': 'text/plain', 'language': None, 'base': 'https://www.clarin.com/rss/politica/', 'value': 'Alberto Fernández en España: la convivencia PJ-La Cámpora y el pedido de la jefa del Santander'}","[{'rel': 'alternate', 'type': 'text/html', 'href': 'http://www.clarin.com/politica/alberto-fernandez-espana-convivencia-pj-campora-pedido-jefa-santander_0_R4WneldjX.html'}, {'length': '0', 'type': 'image/jpg', 'href': 'https://images.clarin.com/2019/09/03/QrBaDFJyV_600x338__1.jpg', 'rel': 'enclosure'}]",http://www.clarin.com/politica/alberto-fernandez-espana-convivencia-pj-campora-pedido-jefa-santander_0_R4WneldjX.html,"El candidato habló con Clarín de un futuro gobierno. Este miércoles, reuniones con empresarios.","{'type': 'text/html', 'language': None, 'base': 'https://www.clarin.com/rss/politica/', 'value': 'El candidato habló con Clarín de un futuro gobierno. Este miércoles, reuniones con empresarios.'}",http://www.clarin.com/politica/alberto-fernandez-espana-convivencia-pj-campora-pedido-jefa-santander_0_R4WneldjX.html,False,"Wed, 04 Sep 2019 10:36:09 -0300","time.struct_time(tm_year=2019, tm_mon=9, tm_mday=4, tm_hour=13, tm_min=36, tm_sec=9, tm_wday=2, tm_yday=247, tm_isdst=0)",[{'name': 'Clarin.com'}],Clarin.com,{'name': 'Clarin.com'}
8,Petroleros despejaron a los golpes una ruta cortada por docentes en Chubut,"{'type': 'text/plain', 'language': None, 'base': 'https://www.clarin.com/rss/politica/', 'value': 'Petroleros despejaron a los golpes una ruta cortada por docentes en Chubut'}","[{'rel': 'alternate', 'type': 'text/html', 'href': 'http://www.clarin.com/politica/petroleros-despejaron-golpes-ruta-cortada-docentes-chubut_0_xGylNOGbi.html'}, {'length': '0', 'type': 'image/jpg', 'href': 'https://images.clarin.com/2019/09/04/a5mkCsCT4_600x338__1.jpg', 'rel': 'enclosure'}]",http://www.clarin.com/politica/petroleros-despejaron-golpes-ruta-cortada-docentes-chubut_0_xGylNOGbi.html,"Jorge Ávila, líder del sindicato, había advertido horas antes que iban a ""pasar por arriba de los piquetes"".","{'type': 'text/html', 'language': None, 'base': 'https://www.clarin.com/rss/politica/', 'value': 'Jorge Ávila, líder del sindicato, había advertido horas antes que iban a ""pasar por arriba de los piquetes"".'}",http://www.clarin.com/politica/petroleros-despejaron-golpes-ruta-cortada-docentes-chubut_0_xGylNOGbi.html,False,"Wed, 04 Sep 2019 10:21:03 -0300","time.struct_time(tm_year=2019, tm_mon=9, tm_mday=4, tm_hour=13, tm_min=21, tm_sec=3, tm_wday=2, tm_yday=247, tm_isdst=0)",[{'name': 'Clarin.com'}],Clarin.com,{'name': 'Clarin.com'}
9,"Es falso que la reforma laboral propuesta por el Gobierno ""permite que un empleado pueda ser despedido sin indemnización alguna""","{'type': 'text/plain', 'language': None, 'base': 'https://www.clarin.com/rss/politica/', 'value': 'Es falso que la reforma laboral propuesta por el Gobierno ""permite que un empleado pueda ser despedido sin indemnización alguna""'}","[{'rel': 'alternate', 'type': 'text/html', 'href': 'http://www.clarin.com/politica/reverso-falso-reforma-laboral-propuesta-gobierno-permite-empleado-pueda-despedido-indemnizacion-alguna-_0_PFh53jbZ2.html'}, {'length': '0', 'type': 'image/jpg', 'href': 'https://images.clarin.com/2019/09/04/OhCcjtUaC_600x338__1.jpg', 'rel': 'enclosure'}]",http://www.clarin.com/politica/reverso-falso-reforma-laboral-propuesta-gobierno-permite-empleado-pueda-despedido-indemnizacion-alguna-_0_PFh53jbZ2.html,"Esta nota es parte de Reverso, el proyecto periodístico colaborativo que une a Clarín y más de 100 medios en la lucha contra la desinformación.","{'type': 'text/html', 'language': None, 'base': 'https://www.clarin.com/rss/politica/', 'value': 'Esta nota es parte de Reverso, el proyecto periodístico colaborativo que une a Clarín y más de 100 medios en la lucha contra la desinformación.'}",http://www.clarin.com/politica/reverso-falso-reforma-laboral-propuesta-gobierno-permite-empleado-pueda-despedido-indemnizacion-alguna-_0_PFh53jbZ2.html,False,"Wed, 04 Sep 2019 10:10:40 -0300","time.struct_time(tm_year=2019, tm_mon=9, tm_mday=4, tm_hour=13, tm_min=10, tm_sec=40, tm_wday=2, tm_yday=247, tm_isdst=0)",[{'name': 'Clarin.com'}],Clarin.com,{'name': 'Clarin.com'}
0,Se conocieron escalofriantes detalles sobre el quíntuple asesinato cometido por un chico de 14 años,"{'type': 'text/plain', 'language': None, 'base': 'https://www.clarin.com/rss/mundo/', 'value': 'Se conocieron escalofriantes detalles sobre el quíntuple asesinato cometido por un chico de 14 años'}","[{'rel': 'alternate', 'type': 'text/html', 'href': 'http://www.clarin.com/sociedad/conocieron-escalofriantes-detalles-quintuple-asesinato-cometido-chico-14-anos_0_cKaRT0kA6.html'}, {'length': '0', 'type': 'image/jpg', 'href': 'https://images.clarin.com/2019/09/04/-whziCh3v_600x338__1.jpg', 'rel': 'enclosure'}]",http://www.clarin.com/sociedad/conocieron-escalofriantes-detalles-quintuple-asesinato-cometido-chico-14-anos_0_cKaRT0kA6.html,"El adolescente mató a balazos a su padre, a su madrastra y a sus tres hermanastros. Fue en un pueblo de apenas 500 habitantes.","{'type': 'text/html', 'language': None, 'base': 'https://www.clarin.com/rss/mundo/', 'value': 'El adolescente mató a balazos a su padre, a su madrastra y a sus tres hermanastros. Fue en un pueblo de apenas 500 habitantes.'}",http://www.clarin.com/sociedad/conocieron-escalofriantes-detalles-quintuple-asesinato-cometido-chico-14-anos_0_cKaRT0kA6.html,False,"Wed, 04 Sep 2019 14:09:44 -0300","time.struct_time(tm_year=2019, tm_mon=9, tm_mday=4, tm_hour=17, tm_min=9, tm_sec=44, tm_wday=2, tm_yday=247, tm_isdst=0)",[{'name': 'Clarin.com'}],Clarin.com,{'name': 'Clarin.com'}
1,El Parlamento británico da un primer paso para bloquear un Brexit sin acuerdo,"{'type': 'text/plain', 'language': None, 'base': 'https://www.clarin.com/rss/mundo/', 'value': 'El Parlamento británico da un primer paso para bloquear un Brexit sin acuerdo'}","[{'rel': 'alternate', 'type': 'text/html', 'href': 'http://www.clarin.com/mundo/parlamento-britanico-da-primer-paso-bloquear-brexit-acuerdo_0_lboaFxAe1.html'}, {'length': '0', 'type': 'image/jpg', 'href': 'https://images.clarin.com/2019/09/04/OBDSEKPBl_600x338__1.jpg', 'rel': 'enclosure'}]",http://www.clarin.com/mundo/parlamento-britanico-da-primer-paso-bloquear-brexit-acuerdo_0_lboaFxAe1.html,"Con 329 votos a favor y 300 en contra, la Cámara de los Comunes dio un primer sí a una ley que obliga a Boris Johnson a pedir a la Unión Europea una prórroga del divorcio si no se llega a un acuerdo antes del 19 de octubre.","{'type': 'text/html', 'language': None, 'base': 'https://www.clarin.com/rss/mundo/', 'value': 'Con 329 votos a favor y 300 en contra, la Cámara de los Comunes dio un primer sí a una ley que obliga a Boris Johnson a pedir a la Unión Europea una prórroga del divorcio si no se llega a un acuerdo antes del 19 de octubre.'}",http://www.clarin.com/mundo/parlamento-britanico-da-primer-paso-bloquear-brexit-acuerdo_0_lboaFxAe1.html,False,"Wed, 04 Sep 2019 14:01:16 -0300","time.struct_time(tm_year=2019, tm_mon=9, tm_mday=4, tm_hour=17, tm_min=1, tm_sec=16, tm_wday=2, tm_yday=247, tm_isdst=0)",[{'name': 'Clarin.com'}],Clarin.com,{'name': 'Clarin.com'}
2,"El Papa Francisco ya está en Mozambique: en el avión habló sobre el ""complot"" contra su pontificado","{'type': 'text/plain', 'language': None, 'base': 'https://www.clarin.com/rss/mundo/', 'value': 'El Papa Francisco ya está en Mozambique: en el avión habló sobre el ""complot"" contra su pontificado'}","[{'rel': 'alternate', 'type': 'text/html', 'href': 'http://www.clarin.com/mundo/papa-francisco-mozambique-avion-hablo-complot-pontificado_0_zJNBHwqCy.html'}, {'length': '0', 'type': 'image/jpg', 'href': 'https://images.clarin.com/2019/09/04/u5K2nU5mS_600x338__1.jpg', 'rel': 'enclosure'}]",http://www.clarin.com/mundo/papa-francisco-mozambique-avion-hablo-complot-pontificado_0_zJNBHwqCy.html,"Se refirió a un libro que trata sobre los planes en EE.UU. para anular su papado. ""Es una bomba"", dijo.","{'type': 'text/html', 'language': None, 'base': 'https://www.clarin.com/rss/mundo/', 'value': 'Se refirió a un libro que trata sobre los planes en EE.UU. para anular su papado. ""Es una bomba"", dijo.'}",http://www.clarin.com/mundo/papa-francisco-mozambique-avion-hablo-complot-pontificado_0_zJNBHwqCy.html,False,"Wed, 04 Sep 2019 13:59:53 -0300","time.struct_time(tm_year=2019, tm_mon=9, tm_mday=4, tm_hour=16, tm_min=59, tm_sec=53, tm_wday=2, tm_yday=247, tm_isdst=0)",[{'name': 'Clarin.com'}],Clarin.com,{'name': 'Clarin.com'}
3,Giuseppe Conte ya armó su gabinete en Italia: Luigi Di Maio será canciller,"{'type': 'text/plain', 'language': None, 'base': 'https://www.clarin.com/rss/mundo/', 'value': 'Giuseppe Conte ya armó su gabinete en Italia: Luigi Di Maio será canciller'}","[{'rel': 'alternate', 'type': 'text/html', 'href': 'http://www.clarin.com/mundo/giuseppe-conte-armo-gabinete-italia-luigi-di-maio-canciller_0_opvxZp_6b.html'}, {'length': '0', 'type': 'image/jpg', 'href': 'https://images.clarin.com/2019/09/04/-WcjJtm6s_600x338__1.jpg', 'rel': 'enclosure'}]",http://www.clarin.com/mundo/giuseppe-conte-armo-gabinete-italia-luigi-di-maio-canciller_0_opvxZp_6b.html,"El premier y sus 21 ministros jurarán este jueves ante el presidente Sergio Mattarella. Diez de ellos son del Movimiento 5 Estrellas, 9 del Partido Democrático y dos independientes.","{'type': 'text/html', 'language': None, 'base': 'https://www.clarin.com/rss/mundo/', 'value': 'El premier y sus 21 ministros jurarán este jueves ante el presidente Sergio Mattarella. Diez de ellos son del Movimiento 5 Estrellas, 9 del Partido Democrático y dos independientes.'}",http://www.clarin.com/mundo/giuseppe-conte-armo-gabinete-italia-luigi-di-maio-canciller_0_opvxZp_6b.html,False,"Wed, 04 Sep 2019 12:45:20 -0300","time.struct_time(tm_year=2019, tm_mon=9, tm_mday=4, tm_hour=15, tm_min=45, tm_sec=20, tm_wday=2, tm_yday=247, tm_isdst=0)",[{'name': 'Clarin.com'}],Clarin.com,{'name': 'Clarin.com'}
4,"El ex FARC, Iván Márquez, ahora anuncia en nuevo video un ""movimiento político""","{'type': 'text/plain', 'language': None, 'base': 'https://www.clarin.com/rss/mundo/', 'value': 'El ex FARC, Iván Márquez, ahora anuncia en nuevo video un ""movimiento político""'}","[{'rel': 'alternate', 'type': 'text/html', 'href': 'http://www.clarin.com/mundo/ex-farc-ivan-marquez-ahora-anuncia-nuevo-video-movimiento-politico-_0_j8_SZDWGL.html'}, {'length': '0', 'type': 'image/jpg', 'href': 'https://images.clarin.com/2019/09/04/76Jf9Nf6g_600x338__1.jpg', 'rel': 'enclosure'}]",http://www.clarin.com/mundo/ex-farc-ivan-marquez-ahora-anuncia-nuevo-video-movimiento-politico-_0_j8_SZDWGL.html,Dijo que operará en la clandestinidad. La semana pasada había anunciado el regreso a las armas.,"{'type': 'text/html', 'language': None, 'base': 'https://www.clarin.com/rss/mundo/', 'value': 'Dijo que operará en la clandestinidad. La semana pasada había anunciado el regreso a las armas.'}",http://www.clarin.com/mundo/ex-farc-ivan-marquez-ahora-anuncia-nuevo-video-movimiento-politico-_0_j8_SZDWGL.html,False,"Wed, 04 Sep 2019 12:35:46 -0300","time.struct_time(tm_year=2019, tm_mon=9, tm_mday=4, tm_hour=15, tm_min=35, tm_sec=46, tm_wday=2, tm_yday=247, tm_isdst=0)",[{'name': 'Clarin.com'}],Clarin.com,{'name': 'Clarin.com'}
5,"Revés para Nicolás Maduro: por el bloqueo de Estados Unidos, una petrolera china deja de producir en Venezuela","{'type': 'text/plain', 'language': None, 'base': 'https://www.clarin.com/rss/mundo/', 'value': 'Revés para Nicolás Maduro: por el bloqueo de Estados Unidos, una petrolera china deja de producir en Venezuela'}","[{'rel': 'alternate', 'type': 'text/html', 'href': 'http://www.clarin.com/mundo/reves-nicolas-maduro-sanciones-unidos-petrolera-china-deja-producir-venezuela_0_oS-dYSGRA.html'}, {'length': '0', 'type': 'image/jpg', 'href': 'https://images.clarin.com/2019/09/04/-PeuQx_yD_600x338__1.jpg', 'rel': 'enclosure'}]",http://www.clarin.com/mundo/reves-nicolas-maduro-sanciones-unidos-petrolera-china-deja-producir-venezuela_0_oS-dYSGRA.html,"Es la empresa CNPC, uno de los principales socios de la estatal venezolana PDVSA. Busca así evitar sanciones del gobierno de Donald Trump.","{'type': 'text/html', 'language': None, 'base': 'https://www.clarin.com/rss/mundo/', 'value': 'Es la empresa CNPC, uno de los principales socios de la estatal venezolana PDVSA. Busca así evitar sanciones del gobierno de Donald Trump.'}",http://www.clarin.com/mundo/reves-nicolas-maduro-sanciones-unidos-petrolera-china-deja-producir-venezuela_0_oS-dYSGRA.html,False,"Wed, 04 Sep 2019 12:10:55 -0300","time.struct_time(tm_year=2019, tm_mon=9, tm_mday=4, tm_hour=15, tm_min=10, tm_sec=55, tm_wday=2, tm_yday=247, tm_isdst=0)",[{'name': 'Clarin.com'}],Clarin.com,{'name': 'Clarin.com'}
6,Día clave en el Parlamento británico para el futuro de Boris Johnson y el Brexit,"{'type': 'text/plain', 'language': None, 'base': 'https://www.clarin.com/rss/mundo/', 'value': 'Día clave en el Parlamento británico para el futuro de Boris Johnson y el Brexit'}","[{'rel': 'alternate', 'type': 'text/html', 'href': 'http://www.clarin.com/mundo/dia-clave-parlamento-britanico-futuro-boris-johnson-brexit_0_LiFrUXqt-.html'}, {'length': '0', 'type': 'image/jpg', 'href': 'https://images.clarin.com/2019/09/04/c9XAD8RTi_600x338__1.jpg', 'rel': 'enclosure'}]",http://www.clarin.com/mundo/dia-clave-parlamento-britanico-futuro-boris-johnson-brexit_0_LiFrUXqt-.html,Los diputados buscarán aprobar una norma para que el primer ministro pida a la Unión Europea una postergación de la salida del Reino. Y votarán contra su plan de elecciones anticipadas.,"{'type': 'text/html', 'language': None, 'base': 'https://www.clarin.com/rss/mundo/', 'value': 'Los diputados buscarán aprobar una norma para que el primer ministro pida a la Unión Europea una postergación de la salida del Reino. Y votarán contra su plan de elecciones anticipadas.'}",http://www.clarin.com/mundo/dia-clave-parlamento-britanico-futuro-boris-johnson-brexit_0_LiFrUXqt-.html,False,"Wed, 04 Sep 2019 11:35:02 -0300","time.struct_time(tm_year=2019, tm_mon=9, tm_mday=4, tm_hour=14, tm_min=35, tm_sec=2, tm_wday=2, tm_yday=247, tm_isdst=0)",[{'name': 'Clarin.com'}],Clarin.com,{'name': 'Clarin.com'}
7,"Entrevista a Ivanka Trump: ""Estados Unidos y Argentina son amigos y fuertes socios económicos""","{'type': 'text/plain', 'language': None, 'base': 'https://www.clarin.com/rss/mundo/', 'value': 'Entrevista a Ivanka Trump: ""Estados Unidos y Argentina son amigos y fuertes socios económicos""'}","[{'rel': 'alternate', 'type': 'text/html', 'href': 'http://www.clarin.com/mundo/entrevista-ivanka-trump-unidos-argentina-amigos-fuertes-socios-economicos-_0_ohOsc6bn8.html'}, {'length': '0', 'type': 'image/jpg', 'href': 'https://images.clarin.com/2019/09/04/aCW2HWzXU_600x338__1.jpg', 'rel': 'enclosure'}]",http://www.clarin.com/mundo/entrevista-ivanka-trump-unidos-argentina-amigos-fuertes-socios-economicos-_0_ohOsc6bn8.html,La hija del presidente de EE.UU. respondió por email preguntas de Clarín antes de viajar a nuestro país.,"{'type': 'text/html', 'language': None, 'base': 'https://www.clarin.com/rss/mundo/', 'value': 'La hija del presidente de EE.UU. respondió por email preguntas de Clarín antes de viajar a nuestro país.'}",http://www.clarin.com/mundo/entrevista-ivanka-trump-unidos-argentina-amigos-fuertes-socios-economicos-_0_ohOsc6bn8.html,False,"Wed, 04 Sep 2019 11:09:08 -0300","time.struct_time(tm_year=2019, tm_mon=9, tm_mday=4, tm_hour=14, tm_min=9, tm_sec=8, tm_wday=2, tm_yday=247, tm_isdst=0)",[{'name': 'Clarin.com'}],Clarin.com,{'name': 'Clarin.com'}
8,Huracán Dorian: así quedó Bahamas,"{'type': 'text/plain', 'language': None, 'base': 'https://www.clarin.com/rss/mundo/', 'value': 'Huracán Dorian: así quedó Bahamas'}","[{'rel': 'alternate', 'type': 'text/html', 'href': 'http://www.clarin.com/mundo/huracan-dorian-quedo-bahamas_0_wC2wMKyew.html'}, {'length': '0', 'type': 'image/jpg', 'href': 'https://images.clarin.com/2019/09/04/vZZ41s7xw_600x338__1.jpg', 'rel': 'enclosure'}]",http://www.clarin.com/mundo/huracan-dorian-quedo-bahamas_0_wC2wMKyew.html,Hay gente atrapada en sus casas y barrios enteros destruidos. Devastación total.,"{'type': 'text/html', 'language': None, 'base': 'https://www.clarin.com/rss/mundo/', 'value': 'Hay gente atrapada en sus casas y barrios enteros destruidos. Devastación total.'}",http://www.clarin.com/mundo/huracan-dorian-quedo-bahamas_0_wC2wMKyew.html,False,"Wed, 04 Sep 2019 10:51:24 -0300","time.struct_time(tm_year=2019, tm_mon=9, tm_mday=4, tm_hour=13, tm_min=51, tm_sec=24, tm_wday=2, tm_yday=247, tm_isdst=0)",[{'name': 'Clarin.com'}],Clarin.com,{'name': 'Clarin.com'}
9,Dura crítica de Bolsonaro a Bachelet: atacó a su padre muerto por Pinochet y la acusó de intromisión,"{'type': 'text/plain', 'language': None, 'base': 'https://www.clarin.com/rss/mundo/', 'value': 'Dura crítica de Bolsonaro a Bachelet: atacó a su padre muerto por Pinochet y la acusó de intromisión'}","[{'rel': 'alternate', 'type': 'text/html', 'href': 'http://www.clarin.com/mundo/dura-critica-bolsonaro-bachelet-ataco-padre-muerto-pinochet-acuso-intromision_0_u4G12kIKP.html'}, {'length': '0', 'type': 'image/jpg', 'href': 'https://images.clarin.com/2019/09/04/DiaATgQU2_600x338__1.jpg', 'rel': 'enclosure'}]",http://www.clarin.com/mundo/dura-critica-bolsonaro-bachelet-ataco-padre-muerto-pinochet-acuso-intromision_0_u4G12kIKP.html,Fue luego de que la Alta Comisionada de la ONU alertara sobre una reducción del espacio democrático en Brasil.,"{'type': 'text/html', 'language': None, 'base': 'https://www.clarin.com/rss/mundo/', 'value': 'Fue luego de que la Alta Comisionada de la ONU alertara sobre una reducción del espacio democrático en Brasil.'}",http://www.clarin.com/mundo/dura-critica-bolsonaro-bachelet-ataco-padre-muerto-pinochet-acuso-intromision_0_u4G12kIKP.html,False,"Wed, 04 Sep 2019 10:39:30 -0300","time.struct_time(tm_year=2019, tm_mon=9, tm_mday=4, tm_hour=13, tm_min=39, tm_sec=30, tm_wday=2, tm_yday=247, tm_isdst=0)",[{'name': 'Clarin.com'}],Clarin.com,{'name': 'Clarin.com'}
0,"Mientras sigue el ""éxodo"" de las prepagas, hay polémica sobre cómo se calculan los aumentos","{'type': 'text/plain', 'language': None, 'base': 'https://www.clarin.com/rss/sociedad/', 'value': 'Mientras sigue el ""éxodo"" de las prepagas, hay polémica sobre cómo se calculan los aumentos'}","[{'rel': 'alternate', 'type': 'text/html', 'href': 'http://www.clarin.com/sociedad/sigue-exodo-prepagas-polemica-calculan-aumentos_0_-Ev6aTdab.html'}, {'length': '0', 'type': 'image/jpg', 'href': 'https://images.clarin.com/2019/09/03/9Fdv_6Sb-_600x338__1.jpg', 'rel': 'enclosure'}]",http://www.clarin.com/sociedad/sigue-exodo-prepagas-polemica-calculan-aumentos_0_-Ev6aTdab.html,Fuentes del sector estiman una baja de afiliados de entre el 10% y el 20% en 3 años. Desde el Estado admiten defectos en la forma de evaluar las subas. Y desde las empresas dicen que las cuotas deberían ser aún más caras.,"{'type': 'text/html', 'language': None, 'base': 'https://www.clarin.com/rss/sociedad/', 'value': 'Fuentes del sector estiman una baja de afiliados de entre el 10% y el 20% en 3 años. Desde el Estado admiten defectos en la forma de evaluar las subas. Y desde las empresas dicen que las cuotas deberían ser aún más caras.'}",http://www.clarin.com/sociedad/sigue-exodo-prepagas-polemica-calculan-aumentos_0_-Ev6aTdab.html,False,"Wed, 04 Sep 2019 14:16:02 -0300","time.struct_time(tm_year=2019, tm_mon=9, tm_mday=4, tm_hour=17, tm_min=16, tm_sec=2, tm_wday=2, tm_yday=247, tm_isdst=0)",[{'name': 'Clarin.com'}],Clarin.com,{'name': 'Clarin.com'}
1,Se conocieron escalofriantes detalles sobre el quíntuple asesinato cometido por un chico de 14 años,"{'type': 'text/plain', 'language': None, 'base': 'https://www.clarin.com/rss/sociedad/', 'value': 'Se conocieron escalofriantes detalles sobre el quíntuple asesinato cometido por un chico de 14 años'}","[{'rel': 'alternate', 'type': 'text/html', 'href': 'http://www.clarin.com/sociedad/conocieron-escalofriantes-detalles-quintuple-asesinato-cometido-chico-14-anos_0_cKaRT0kA6.html'}, {'length': '0', 'type': 'image/jpg', 'href': 'https://images.clarin.com/2019/09/04/-whziCh3v_600x338__1.jpg', 'rel': 'enclosure'}]",http://www.clarin.com/sociedad/conocieron-escalofriantes-detalles-quintuple-asesinato-cometido-chico-14-anos_0_cKaRT0kA6.html,"El adolescente mató a balazos a su padre, a su madrastra y a sus tres hermanastros. Fue en un pueblo de apenas 500 habitantes.","{'type': 'text/html', 'language': None, 'base': 'https://www.clarin.com/rss/sociedad/', 'value': 'El adolescente mató a balazos a su padre, a su madrastra y a sus tres hermanastros. Fue en un pueblo de apenas 500 habitantes.'}",http://www.clarin.com/sociedad/conocieron-escalofriantes-detalles-quintuple-asesinato-cometido-chico-14-anos_0_cKaRT0kA6.html,False,"Wed, 04 Sep 2019 14:09:44 -0300","time.struct_time(tm_year=2019, tm_mon=9, tm_mday=4, tm_hour=17, tm_min=9, tm_sec=44, tm_wday=2, tm_yday=247, tm_isdst=0)",[{'name': 'Clarin.com'}],Clarin.com,{'name': 'Clarin.com'}
2,Un mosaico podría aportar nuevos datos sobre el milagro de Jesús de la multiplicación de los panes,"{'type': 'text/plain', 'language': None, 'base': 'https://www.clarin.com/rss/sociedad/', 'value': 'Un mosaico podría aportar nuevos datos sobre el milagro de Jesús de la multiplicación de los panes'}","[{'rel': 'alternate', 'type': 'text/html', 'href': 'http://www.clarin.com/sociedad/mosaico-podria-aportar-nuevos-datos-milagro-jesus-multiplicacion-panes_0_1PdH6-JY9.html'}, {'length': '0', 'type': 'image/jpg', 'href': 'https://images.clarin.com/2019/09/04/W_Qy5aAid_600x338__1.jpg', 'rel': 'enclosure'}]",http://www.clarin.com/sociedad/mosaico-podria-aportar-nuevos-datos-milagro-jesus-multiplicacion-panes_0_1PdH6-JY9.html,"Fue encontrado entre los restos de la ciudad de Hipos, desde donde los primeros cristianos veían las aguas en las que, según la tradición, caminó Jesucristo.","{'type': 'text/html', 'language': None, 'base': 'https://www.clarin.com/rss/sociedad/', 'value': 'Fue encontrado entre los restos de la ciudad de Hipos, desde donde los primeros cristianos veían las aguas en las que, según la tradición, caminó Jesucristo.'}",http://www.clarin.com/sociedad/mosaico-podria-aportar-nuevos-datos-milagro-jesus-multiplicacion-panes_0_1PdH6-JY9.html,False,"Wed, 04 Sep 2019 11:20:01 -0300","time.struct_time(tm_year=2019, tm_mon=9, tm_mday=4, tm_hour=14, tm_min=20, tm_sec=1, tm_wday=2, tm_yday=247, tm_isdst=0)",[{'name': 'Clarin.com'}],Clarin.com,{'name': 'Clarin.com'}
3,Docentes convocaron a un paro nacional para el jueves por la agresión a maestros en Chubut,"{'type': 'text/plain', 'language': None, 'base': 'https://www.clarin.com/rss/sociedad/', 'value': 'Docentes convocaron a un paro nacional para el jueves por la agresión a maestros en Chubut'}","[{'rel': 'alternate', 'type': 'text/html', 'href': 'http://www.clarin.com/sociedad/docentes-convocaron-paro-nacional-jueves-agresion-maestros-chubut_0_hd1Cbafsk.html'}, {'length': '0', 'type': 'image/jpg', 'href': 'https://images.clarin.com/2019/03/08/ZWQ6nRPgk_600x338__1.jpg', 'rel': 'enclosure'}]",http://www.clarin.com/sociedad/docentes-convocaron-paro-nacional-jueves-agresion-maestros-chubut_0_hd1Cbafsk.html,"Fue luego de que sindicalistas petroleros agredieran a un grupo de maestros que protestaban en la intersección de las rutas 3 y 26, al sur de Comodoro Rivadavia.","{'type': 'text/html', 'language': None, 'base': 'https://www.clarin.com/rss/sociedad/', 'value': 'Fue luego de que sindicalistas petroleros agredieran a un grupo de maestros que protestaban en la intersección de las rutas 3 y 26, al sur de Comodoro Rivadavia.'}",http://www.clarin.com/sociedad/docentes-convocaron-paro-nacional-jueves-agresion-maestros-chubut_0_hd1Cbafsk.html,False,"Wed, 04 Sep 2019 11:13:38 -0300","time.struct_time(tm_year=2019, tm_mon=9, tm_mday=4, tm_hour=14, tm_min=13, tm_sec=38, tm_wday=2, tm_yday=247, tm_isdst=0)",[{'name': 'Clarin.com'}],Clarin.com,{'name': 'Clarin.com'}
4,"Lucas Carrasco, el ex 678 acusado de abuso, habló ante el tribunal: ""Nunca fue mi intención violar a alguien""","{'type': 'text/plain', 'language': None, 'base': 'https://www.clarin.com/rss/sociedad/', 'value': 'Lucas Carrasco, el ex 678 acusado de abuso, habló ante el tribunal: ""Nunca fue mi intención violar a alguien""'}","[{'rel': 'alternate', 'type': 'text/html', 'href': 'http://www.clarin.com/sociedad/lucas-carrasco-ex-678-acusado-abuso-persona-amable-mundo-violador-_0_RYPKPgCry.html'}, {'length': '0', 'type': 'image/jpg', 'href': 'https://images.clarin.com/2019/09/04/0Db2ERi8Z_600x338__1.jpg', 'rel': 'enclosure'}]",http://www.clarin.com/sociedad/lucas-carrasco-ex-678-acusado-abuso-persona-amable-mundo-violador-_0_RYPKPgCry.html,"""Sé que no soy la persona más amable del mundo, pero no soy un violador"", declaró el periodista y tuitero K. Está acusado por dos mujeres.","{'type': 'text/html', 'language': None, 'base': 'https://www.clarin.com/rss/sociedad/', 'value': '""Sé que no soy la persona más amable del mundo, pero no soy un violador"", declaró el periodista y tuitero K. Está acusado por dos mujeres.'}",http://www.clarin.com/sociedad/lucas-carrasco-ex-678-acusado-abuso-persona-amable-mundo-violador-_0_RYPKPgCry.html,False,"Wed, 04 Sep 2019 10:17:53 -0300","time.struct_time(tm_year=2019, tm_mon=9, tm_mday=4, tm_hour=13, tm_min=17, tm_sec=53, tm_wday=2, tm_yday=247, tm_isdst=0)",[{'name': 'Clarin.com'}],Clarin.com,{'name': 'Clarin.com'}
