,title,title_detail,links,link,summary,summary_detail,id,guidislink,published,published_parsed,authors,author,author_detail
5,"Denuncian que un ""mago"" abusó y drogó a nenes en un jardín de infantes","{'type': 'text/plain', 'language': None, 'base': 'https://www.clarin.com/rss/sociedad/', 'value': 'Denuncian que un ""mago"" abusó y drogó a nenes en un jardín de infantes'}","[{'rel': 'alternate', 'type': 'text/html', 'href': 'http://www.clarin.com/sociedad/denuncian-mago-abuso-drogo-nenes-jardin-infantes_0_2gSzdlHsK.html'}, {'length': '0', 'type': 'image/jpg', 'href': 'https://images.clarin.com/2019/09/04/dF1AXkogW_600x338__1.jpg', 'rel': 'enclosure'}]",http://www.clarin.com/sociedad/denuncian-mago-abuso-drogo-nenes-jardin-infantes_0_2gSzdlHsK.html,"El acusado, de 34 años, ofrecía shows de magia para los chicos. Hay al menos siete denuncias en su contra y unos 90 menores habrían sido testigos de los abusos.","{'type': 'text/html', 'language': None, 'base': 'https://www.clarin.com/rss/sociedad/', 'value': 'El acusado, de 34 años, ofrecía shows de magia para los chicos. Hay al menos siete denuncias en su contra y unos 90 menores habrían sido testigos de los abusos.'}",http://www.clarin.com/sociedad/denuncian-mago-abuso-drogo-nenes-jardin-infantes_0_2gSzdlHsK.html,False,"Wed, 04 Sep 2019 09:15:03 -0300","time.struct_time(tm_year=2019, tm_mon=9, tm_mday=4, tm_hour=12, tm_min=15, tm_sec=3, tm_wday=2, tm_yday=247, tm_isdst=0)",[{'name': 'Clarin.com'}],Clarin.com,{'name': 'Clarin.com'}
6,Pronóstico del tiempo en Capital y Gran Buenos Aires: hasta cuándo seguirá la ola de frío,"{'type': 'text/plain', 'language': None, 'base': 'https://www.clarin.com/rss/sociedad/', 'value': 'Pronóstico del tiempo en Capital y Gran Buenos Aires: hasta cuándo seguirá la ola de frío'}","[{'rel': 'alternate', 'type': 'text/html', 'href': 'http://www.clarin.com/sociedad/pronostico-tiempo-capital-gran-buenos-aires-seguira-ola-frio_0_Ia1W5O8rb.html'}, {'length': '0', 'type': 'image/jpg', 'href': 'https://images.clarin.com/2019/09/04/t2Q1YvAP2_600x338__1.jpg', 'rel': 'enclosure'}]",http://www.clarin.com/sociedad/pronostico-tiempo-capital-gran-buenos-aires-seguira-ola-frio_0_Ia1W5O8rb.html,"El Servicio Meteorológico Nacional prevé que las bajas temperaturas sigan, al menos, hasta el viernes.","{'type': 'text/html', 'language': None, 'base': 'https://www.clarin.com/rss/sociedad/', 'value': 'El Servicio Meteorológico Nacional prevé que las bajas temperaturas sigan, al menos, hasta el viernes.'}",http://www.clarin.com/sociedad/pronostico-tiempo-capital-gran-buenos-aires-seguira-ola-frio_0_Ia1W5O8rb.html,False,"Wed, 04 Sep 2019 08:17:08 -0300","time.struct_time(tm_year=2019, tm_mon=9, tm_mday=4, tm_hour=11, tm_min=17, tm_sec=8, tm_wday=2, tm_yday=247, tm_isdst=0)",[{'name': 'Clarin.com'}],Clarin.com,{'name': 'Clarin.com'}
7,Choque múltiple en Panamericana: hay dos heridos,"{'type': 'text/plain', 'language': None, 'base': 'https://www.clarin.com/rss/sociedad/', 'value': 'Choque múltiple en Panamericana: hay dos heridos'}","[{'rel': 'alternate', 'type': 'text/html', 'href': 'http://www.clarin.com/sociedad/choque-multiple-panamericana-heridos_0_78sfZXR77.html'}, {'length': '0', 'type': 'image/jpg', 'href': 'https://images.clarin.com/2019/09/04/7Vm8wApBK_600x338__1.jpg', 'rel': 'enclosure'}]",http://www.clarin.com/sociedad/choque-multiple-panamericana-heridos_0_78sfZXR77.html,"Seis vehículos estuvieron involucrados en el accidente, por el que hay cinco carriles obstruidos mano al norte.","{'type': 'text/html', 'language': None, 'base': 'https://www.clarin.com/rss/sociedad/', 'value': 'Seis vehículos estuvieron involucrados en el accidente, por el que hay cinco carriles obstruidos mano al norte.'}",http://www.clarin.com/sociedad/choque-multiple-panamericana-heridos_0_78sfZXR77.html,False,"Wed, 04 Sep 2019 07:22:25 -0300","time.struct_time(tm_year=2019, tm_mon=9, tm_mday=4, tm_hour=10, tm_min=22, tm_sec=25, tm_wday=2, tm_yday=247, tm_isdst=0)",[{'name': 'Clarin.com'}],Clarin.com,{'name': 'Clarin.com'}
8,Los expertos le reclaman al Gobierno estadísticas de mayor calidad de los estudiantes,"{'type': 'text/plain', 'language': None, 'base': 'https://www.clarin.com/rss/sociedad/', 'value': 'Los expertos le reclaman al Gobierno estadísticas de mayor calidad de los estudiantes'}","[{'rel': 'alternate', 'type': 'text/html', 'href': 'http://www.clarin.com/sociedad/expertos-reclaman-gobierno-estadisticas-mayor-calidad-estudiantes_0_jtv0r7ErM.html'}, {'length': '0', 'type': 'image/jpg', 'href': 'https://images.clarin.com/2019/09/03/kNWmZ3eEI_600x338__1.jpg', 'rel': 'enclosure'}]",http://www.clarin.com/sociedad/expertos-reclaman-gobierno-estadisticas-mayor-calidad-estudiantes_0_jtv0r7ErM.html,Servirían para luchar contra el abandono escolar. Las autoridades dicen que están armando una gran base de datos.,"{'type': 'text/html', 'language': None, 'base': 'https://www.clarin.com/rss/sociedad/', 'value': 'Servirían para luchar contra el abandono escolar. Las autoridades dicen que están armando una gran base de datos.'}",http://www.clarin.com/sociedad/expertos-reclaman-gobierno-estadisticas-mayor-calidad-estudiantes_0_jtv0r7ErM.html,False,"Wed, 04 Sep 2019 00:10:54 -0300","time.struct_time(tm_year=2019, tm_mon=9, tm_mday=4, tm_hour=3, tm_min=10, tm_sec=54, tm_wday=2, tm_yday=247, tm_isdst=0)",[{'name': 'Clarin.com'}],Clarin.com,{'name': 'Clarin.com'}
9,Balance educativo de 20 años: hay más alumnos e inversión pero los resultados no mejoran,"{'type': 'text/plain', 'language': None, 'base': 'https://www.clarin.com/rss/sociedad/', 'value': 'Balance educativo de 20 años: hay más alumnos e inversión pero los resultados no mejoran'}","[{'rel': 'alternate', 'type': 'text/html', 'href': 'http://www.clarin.com/sociedad/balance-educativo-20-anos-alumnos-inversion-resultados-mejoran_0_sG6pN-hEh.html'}, {'length': '0', 'type': 'image/jpg', 'href': 'https://images.clarin.com/2019/09/03/nVNwWIOlA_600x338__1.jpg', 'rel': 'enclosure'}]",http://www.clarin.com/sociedad/balance-educativo-20-anos-alumnos-inversion-resultados-mejoran_0_sG6pN-hEh.html,"Entre 1996 y 2018 se sumaron 2 millones de chicos a la escuela. Sin embargo, sólo 3 de cada 10 de los que terminan la secundaria tienen buen nivel en Matemática.","{'type': 'text/html', 'language': None, 'base': 'https://www.clarin.com/rss/sociedad/', 'value': 'Entre 1996 y 2018 se sumaron 2 millones de chicos a la escuela. Sin embargo, sólo 3 de cada 10 de los que terminan la secundaria tienen buen nivel en Matemática.'}",http://www.clarin.com/sociedad/balance-educativo-20-anos-alumnos-inversion-resultados-mejoran_0_sG6pN-hEh.html,False,"Wed, 04 Sep 2019 00:06:54 -0300","time.struct_time(tm_year=2019, tm_mon=9, tm_mday=4, tm_hour=3, tm_min=6, tm_sec=54, tm_wday=2, tm_yday=247, tm_isdst=0)",[{'name': 'Clarin.com'}],Clarin.com,{'name': 'Clarin.com'}
0,"Creyeron que era un ladrón, lo persiguieron entre ocho y lo mataron de un tiro","{'type': 'text/plain', 'language': None, 'base': 'https://www.clarin.com/rss/policiales/', 'value': 'Creyeron que era un ladrón, lo persiguieron entre ocho y lo mataron de un tiro'}","[{'rel': 'alternate', 'type': 'text/html', 'href': 'http://www.clarin.com/policiales/creyeron-ladron-persiguieron-mataron-tiro_0_2nGuM34Tz.html'}, {'length': '0', 'type': 'image/jpg', 'href': 'https://images.clarin.com/2019/09/04/CPgPC3FYa_600x338__1.jpg', 'rel': 'enclosure'}]",http://www.clarin.com/policiales/creyeron-ladron-persiguieron-mataron-tiro_0_2nGuM34Tz.html,"Uno de los atacantes creyó que había entrado a robar a su casa. La víctima, de 32 años, no tenía antecedentes.","{'type': 'text/html', 'language': None, 'base': 'https://www.clarin.com/rss/policiales/', 'value': 'Uno de los atacantes creyó que había entrado a robar a su casa. La víctima, de 32 años, no tenía antecedentes.'}",http://www.clarin.com/policiales/creyeron-ladron-persiguieron-mataron-tiro_0_2nGuM34Tz.html,False,"Wed, 04 Sep 2019 14:21:55 -0300","time.struct_time(tm_year=2019, tm_mon=9, tm_mday=4, tm_hour=17, tm_min=21, tm_sec=55, tm_wday=2, tm_yday=247, tm_isdst=0)",[{'name': 'Clarin.com'}],Clarin.com,{'name': 'Clarin.com'}
1,"Discutió en la calle y lo mató con una ""pistola lapicera"": cayó ""Patalín"", el remisero asesino","{'type': 'text/plain', 'language': None, 'base': 'https://www.clarin.com/rss/policiales/', 'value': 'Discutió en la calle y lo mató con una ""pistola lapicera"": cayó ""Patalín"", el remisero asesino'}","[{'rel': 'alternate', 'type': 'text/html', 'href': 'http://www.clarin.com/policiales/discutio-calle-mato-pistola-lapicera-cayo-patalin-remisero-asesino_0_3VhObMvEO.html'}, {'length': '0', 'type': 'image/jpg', 'href': 'https://images.clarin.com/2019/09/04/UgHb1Qh0K_600x338__1.jpg', 'rel': 'enclosure'}]",http://www.clarin.com/policiales/discutio-calle-mato-pistola-lapicera-cayo-patalin-remisero-asesino_0_3VhObMvEO.html,La víctima tenía 34 años y estaba charlando con una mujer cuando el atacante lo increpó.,"{'type': 'text/html', 'language': None, 'base': 'https://www.clarin.com/rss/policiales/', 'value': 'La víctima tenía 34 años y estaba charlando con una mujer cuando el atacante lo increpó.'}",http://www.clarin.com/policiales/discutio-calle-mato-pistola-lapicera-cayo-patalin-remisero-asesino_0_3VhObMvEO.html,False,"Wed, 04 Sep 2019 09:34:06 -0300","time.struct_time(tm_year=2019, tm_mon=9, tm_mday=4, tm_hour=12, tm_min=34, tm_sec=6, tm_wday=2, tm_yday=247, tm_isdst=0)",[{'name': 'Clarin.com'}],Clarin.com,{'name': 'Clarin.com'}
2,Violento asalto a un supermercado en Ranelagh: encañonaron a un nene de 11 años,"{'type': 'text/plain', 'language': None, 'base': 'https://www.clarin.com/rss/policiales/', 'value': 'Violento asalto a un supermercado en Ranelagh: encañonaron a un nene de 11 años'}","[{'rel': 'alternate', 'type': 'text/html', 'href': 'http://www.clarin.com/policiales/violento-asalto-supermercado-ranelagh-encanonaron-nene-11-anos_0_oUiDQwnFI.html'}, {'length': '0', 'type': 'image/jpg', 'href': 'https://images.clarin.com/2019/09/04/pAbPU-WN6_600x338__1.jpg', 'rel': 'enclosure'}]",http://www.clarin.com/policiales/violento-asalto-supermercado-ranelagh-encanonaron-nene-11-anos_0_oUiDQwnFI.html,Los delincuentes escaparon con la recaudación del comercio y objetos de valor de los clientes.,"{'type': 'text/html', 'language': None, 'base': 'https://www.clarin.com/rss/policiales/', 'value': 'Los delincuentes escaparon con la recaudación del comercio y objetos de valor de los clientes.'}",http://www.clarin.com/policiales/violento-asalto-supermercado-ranelagh-encanonaron-nene-11-anos_0_oUiDQwnFI.html,False,"Wed, 04 Sep 2019 09:33:24 -0300","time.struct_time(tm_year=2019, tm_mon=9, tm_mday=4, tm_hour=12, tm_min=33, tm_sec=24, tm_wday=2, tm_yday=247, tm_isdst=0)",[{'name': 'Clarin.com'}],Clarin.com,{'name': 'Clarin.com'}
3,Detienen un policía acusado de cobrar coimas a feriantes: llevaba un año prófugo y cayó por visitar su negocio,"{'type': 'text/plain', 'language': None, 'base': 'https://www.clarin.com/rss/policiales/', 'value': 'Detienen un policía acusado de cobrar coimas a feriantes: llevaba un año prófugo y cayó por visitar su negocio'}","[{'rel': 'alternate', 'type': 'text/html', 'href': 'http://www.clarin.com/policiales/detienen-policia-acusado-cobrar-coimas-llevaba-ano-profugo-cayo-visitar-negocio_0_6e0AxEIfI.html'}, {'length': '0', 'type': 'image/jpg', 'href': 'https://images.clarin.com/2019/08/09/pDZvUuP8H_600x338__1.jpg', 'rel': 'enclosure'}]",http://www.clarin.com/policiales/detienen-policia-acusado-cobrar-coimas-llevaba-ano-profugo-cayo-visitar-negocio_0_6e0AxEIfI.html,"Está acusado de liderar una banda de extorsionadores. ""Manejaban una de las grandes cajas negras de la Bonaerense"", explican los investigadores.","{'type': 'text/html', 'language': None, 'base': 'https://www.clarin.com/rss/policiales/', 'value': 'Está acusado de liderar una banda de extorsionadores. ""Manejaban una de las grandes cajas negras de la Bonaerense"", explican los investigadores.'}",http://www.clarin.com/policiales/detienen-policia-acusado-cobrar-coimas-llevaba-ano-profugo-cayo-visitar-negocio_0_6e0AxEIfI.html,False,"Wed, 04 Sep 2019 08:01:02 -0300","time.struct_time(tm_year=2019, tm_mon=9, tm_mday=4, tm_hour=11, tm_min=1, tm_sec=2, tm_wday=2, tm_yday=247, tm_isdst=0)",[{'name': 'Clarin.com'}],Clarin.com,{'name': 'Clarin.com'}
4,Video: la impresionante persecución a una banda que hacía salideras bancarias en Vicente López,"{'type': 'text/plain', 'language': None, 'base': 'https://www.clarin.com/rss/policiales/', 'value': 'Video: la impresionante persecución a una banda que hacía salideras bancarias en Vicente López'}","[{'rel': 'alternate', 'type': 'text/html', 'href': 'http://www.clarin.com/policiales/video-impresionante-persecucion-banda-salideras-bancarias-vicente-lopez_0_l8bwNdgSF.html'}, {'length': '0', 'type': 'image/jpg', 'href': 'https://images.clarin.com/2019/09/03/YwMv4UMiy_600x338__1.jpg', 'rel': 'enclosure'}]",http://www.clarin.com/policiales/video-impresionante-persecucion-banda-salideras-bancarias-vicente-lopez_0_l8bwNdgSF.html,Los policías eran guiados por los operadoes de las cámaras de seguridad que alertaban los movimientos de los delincuentes.,"{'type': 'text/html', 'language': None, 'base': 'https://www.clarin.com/rss/policiales/', 'value': 'Los policías eran guiados por los operadoes de las cámaras de seguridad que alertaban los movimientos de los delincuentes.'}",http://www.clarin.com/policiales/video-impresionante-persecucion-banda-salideras-bancarias-vicente-lopez_0_l8bwNdgSF.html,False,"Tue, 03 Sep 2019 20:24:01 -0300","time.struct_time(tm_year=2019, tm_mon=9, tm_mday=3, tm_hour=23, tm_min=24, tm_sec=1, tm_wday=1, tm_yday=246, tm_isdst=0)",[{'name': 'Clarin.com'}],Clarin.com,{'name': 'Clarin.com'}
5,Cómo se busca a un prófugo: recapturan a uno cada tres horas,"{'type': 'text/plain', 'language': None, 'base': 'https://www.clarin.com/rss/policiales/', 'value': 'Cómo se busca a un prófugo: recapturan a uno cada tres horas'}","[{'rel': 'alternate', 'type': 'text/html', 'href': 'http://www.clarin.com/policiales/busca-profugo-recapturan-horas_0_FqF_kTCOT.html'}, {'length': '0', 'type': 'image/jpg', 'href': 'https://images.clarin.com/2018/11/23/s3NETWYZZ_600x338__1.jpg', 'rel': 'enclosure'}]",http://www.clarin.com/policiales/busca-profugo-recapturan-horas_0_FqF_kTCOT.html,Entre 2016 y el primer semestre de 2019 atraparon a 10 mil. Todavía hay unos 40 mil fugitivos.,"{'type': 'text/html', 'language': None, 'base': 'https://www.clarin.com/rss/policiales/', 'value': 'Entre 2016 y el primer semestre de 2019 atraparon a 10 mil. Todavía hay unos 40 mil fugitivos.'}",http://www.clarin.com/policiales/busca-profugo-recapturan-horas_0_FqF_kTCOT.html,False,"Tue, 03 Sep 2019 20:10:25 -0300","time.struct_time(tm_year=2019, tm_mon=9, tm_mday=3, tm_hour=23, tm_min=10, tm_sec=25, tm_wday=1, tm_yday=246, tm_isdst=0)",[{'name': 'Clarin.com'}],Clarin.com,{'name': 'Clarin.com'}
6,En una semana balearon a tres policías en la zona del ex Regimiento La Tablada,"{'type': 'text/plain', 'language': None, 'base': 'https://www.clarin.com/rss/policiales/', 'value': 'En una semana balearon a tres policías en la zona del ex Regimiento La Tablada'}","[{'rel': 'alternate', 'type': 'text/html', 'href': 'http://www.clarin.com/policiales/semana-balearon-policias-zona-ex-regimiento-tablada_0_kSJvDNWra.html'}, {'length': '0', 'type': 'image/jpg', 'href': 'https://images.clarin.com/2019/09/03/SzN3UTPJr_600x338__1.jpg', 'rel': 'enclosure'}]",http://www.clarin.com/policiales/semana-balearon-policias-zona-ex-regimiento-tablada_0_kSJvDNWra.html,A Emmanuel Benítez (30) lo mataron y le robaron su arma. En la misma zona asesinaron a Emilio Ojeda (29) y balearon a Mariana Ontivero (36).,"{'type': 'text/html', 'language': None, 'base': 'https://www.clarin.com/rss/policiales/', 'value': 'A Emmanuel Benítez (30) lo mataron y le robaron su arma. En la misma zona asesinaron a Emilio Ojeda (29) y balearon a Mariana Ontivero (36).'}",http://www.clarin.com/policiales/semana-balearon-policias-zona-ex-regimiento-tablada_0_kSJvDNWra.html,False,"Tue, 03 Sep 2019 19:25:47 -0300","time.struct_time(tm_year=2019, tm_mon=9, tm_mday=3, tm_hour=22, tm_min=25, tm_sec=47, tm_wday=1, tm_yday=246, tm_isdst=0)",[{'name': 'Clarin.com'}],Clarin.com,{'name': 'Clarin.com'}
7,"Piden la captura internacional de Raúl Martins, el ex espía de la SIDE denunciado por proxeneta","{'type': 'text/plain', 'language': None, 'base': 'https://www.clarin.com/rss/policiales/', 'value': 'Piden la captura internacional de Raúl Martins, el ex espía de la SIDE denunciado por proxeneta'}","[{'rel': 'alternate', 'type': 'text/html', 'href': 'http://www.clarin.com/policiales/piden-captura-internacional-raul-martins-ex-espia-side-denunciado-proxeneta_0_7qV_JsAbK.html'}, {'length': '0', 'type': 'image/jpg', 'href': 'https://images.clarin.com/2019/05/08/AKa3fw4EC_600x338__1.jpg', 'rel': 'enclosure'}]",http://www.clarin.com/policiales/piden-captura-internacional-raul-martins-ex-espia-side-denunciado-proxeneta_0_7qV_JsAbK.html,Está acusado de liderar una organización criminal dedicada a la explotación sexual de mujeres.,"{'type': 'text/html', 'language': None, 'base': 'https://www.clarin.com/rss/policiales/', 'value': 'Está acusado de liderar una organización criminal dedicada a la explotación sexual de mujeres.'}",http://www.clarin.com/policiales/piden-captura-internacional-raul-martins-ex-espia-side-denunciado-proxeneta_0_7qV_JsAbK.html,False,"Tue, 03 Sep 2019 17:04:13 -0300","time.struct_time(tm_year=2019, tm_mon=9, tm_mday=3, tm_hour=20, tm_min=4, tm_sec=13, tm_wday=1, tm_yday=246, tm_isdst=0)",[{'name': 'Clarin.com'}],Clarin.com,{'name': 'Clarin.com'}
8,Investigan si los compañeros del policía que mató a un hombre de una patada intentaron encubrirlo,"{'type': 'text/plain', 'language': None, 'base': 'https://www.clarin.com/rss/policiales/', 'value': 'Investigan si los compañeros del policía que mató a un hombre de una patada intentaron encubrirlo'}","[{'rel': 'alternate', 'type': 'text/html', 'href': 'http://www.clarin.com/policiales/investigan-companeros-policia-mato-hombre-patada-intentaron-encubrirlo_0_sJXzTAUQa.html'}, {'length': '0', 'type': 'image/jpg', 'href': 'https://images.clarin.com/2019/08/20/IyHPEFc92_600x338__1.jpg', 'rel': 'enclosure'}]",http://www.clarin.com/policiales/investigan-companeros-policia-mato-hombre-patada-intentaron-encubrirlo_0_sJXzTAUQa.html,"Según trascendió, el efectivo que informó el hecho habló de una muerte ""en la vía pública"" y recién después de varias preguntas de un oficial de Justicia dijo que había un compañero involucrado.","{'type': 'text/html', 'language': None, 'base': 'https://www.clarin.com/rss/policiales/', 'value': 'Según trascendió, el efectivo que informó el hecho habló de una muerte ""en la vía pública"" y recién después de varias preguntas de un oficial de Justicia dijo que había un compañero involucrado.'}",http://www.clarin.com/policiales/investigan-companeros-policia-mato-hombre-patada-intentaron-encubrirlo_0_sJXzTAUQa.html,False,"Tue, 03 Sep 2019 16:26:15 -0300","time.struct_time(tm_year=2019, tm_mon=9, tm_mday=3, tm_hour=19, tm_min=26, tm_sec=15, tm_wday=1, tm_yday=246, tm_isdst=0)",[{'name': 'Clarin.com'}],Clarin.com,{'name': 'Clarin.com'}
9,"Por el aumento de los retiros, amplían el control con cámaras a los bancos de los barrios","{'type': 'text/plain', 'language': None, 'base': 'https://www.clarin.com/rss/policiales/', 'value': 'Por el aumento de los retiros, amplían el control con cámaras a los bancos de los barrios'}","[{'rel': 'alternate', 'type': 'text/html', 'href': 'http://www.clarin.com/policiales/aumento-retiros-amplian-control-camaras-bancos-barrios_0_v0D99FxMR.html'}, {'length': '0', 'type': 'image/jpg', 'href': 'https://images.clarin.com/2019/09/03/KkcE6Vsfh_600x338__1.jpg', 'rel': 'enclosure'}]",http://www.clarin.com/policiales/aumento-retiros-amplian-control-camaras-bancos-barrios_0_v0D99FxMR.html,"Unos 180 policías de la Ciudad recorren a pie la zona del Microcentro. Además de brigadas específicas que buscan a los ""marcadores"" de salideras bancarias.","{'type': 'text/html', 'language': None, 'base': 'https://www.clarin.com/rss/policiales/', 'value': 'Unos 180 policías de la Ciudad recorren a pie la zona del Microcentro. Además de brigadas específicas que buscan a los ""marcadores"" de salideras bancarias.'}",http://www.clarin.com/policiales/aumento-retiros-amplian-control-camaras-bancos-barrios_0_v0D99FxMR.html,False,"Tue, 03 Sep 2019 11:08:57 -0300","time.struct_time(tm_year=2019, tm_mon=9, tm_mday=3, tm_hour=14, tm_min=8, tm_sec=57, tm_wday=1, tm_yday=246, tm_isdst=0)",[{'name': 'Clarin.com'}],Clarin.com,{'name': 'Clarin.com'}
0,"Cristiano Rattazzi y una queja que se repite entre empresarios: ""Con esta inflación, no podemos hacer ninguna cuenta""","{'type': 'text/plain', 'language': None, 'base': 'https://www.clarin.com/rss/economia/', 'value': 'Cristiano Rattazzi y una queja que se repite entre empresarios: ""Con esta inflación, no podemos hacer ninguna cuenta""'}","[{'rel': 'alternate', 'type': 'text/html', 'href': 'http://www.clarin.com/economia/economia/cristiano-rattazzi-queja-repite-empresarios-inflacion-podemos-hacer-cuenta-_0_XpPsF9C9N.html'}, {'length': '0', 'type': 'image/jpg', 'href': 'https://images.clarin.com/2019/09/04/d3De-1o25_600x338__1.jpg', 'rel': 'enclosure'}]",http://www.clarin.com/economia/economia/cristiano-rattazzi-queja-repite-empresarios-inflacion-podemos-hacer-cuenta-_0_XpPsF9C9N.html,"El número uno de Fiat, Costantini, Perez Companc y Macciavello hablaron de impuestos, competitividad, exportaciones y empleo.","{'type': 'text/html', 'language': None, 'base': 'https://www.clarin.com/rss/economia/', 'value': 'El número uno de Fiat, Costantini, Perez Companc y Macciavello hablaron de impuestos, competitividad, exportaciones y empleo.'}",http://www.clarin.com/economia/economia/cristiano-rattazzi-queja-repite-empresarios-inflacion-podemos-hacer-cuenta-_0_XpPsF9C9N.html,False,"Wed, 04 Sep 2019 14:21:32 -0300","time.struct_time(tm_year=2019, tm_mon=9, tm_mday=4, tm_hour=17, tm_min=21, tm_sec=32, tm_wday=2, tm_yday=247, tm_isdst=0)",[{'name': 'Clarin.com'}],Clarin.com,{'name': 'Clarin.com'}
1,"Tras el derrumbe, las acciones argentinas suben hasta 10%","{'type': 'text/plain', 'language': None, 'base': 'https://www.clarin.com/rss/economia/', 'value': 'Tras el derrumbe, las acciones argentinas suben hasta 10%'}","[{'rel': 'alternate', 'type': 'text/html', 'href': 'http://www.clarin.com/economia/economia/derrumbe-acciones-argentinas-suben-10-_0_w8oH4WTc8.html'}, {'length': '0', 'type': 'image/jpg', 'href': 'https://images.clarin.com/2019/09/04/4mDCylpOj_600x338__1.jpg', 'rel': 'enclosure'}]",http://www.clarin.com/economia/economia/derrumbe-acciones-argentinas-suben-10-_0_w8oH4WTc8.html,"El S&P Merval avanza 5,5%, luego de la caída de casi 12% del martes.","{'type': 'text/html', 'language': None, 'base': 'https://www.clarin.com/rss/economia/', 'value': 'El S&P Merval avanza 5,5%, luego de la caída de casi 12% del martes.'}",http://www.clarin.com/economia/economia/derrumbe-acciones-argentinas-suben-10-_0_w8oH4WTc8.html,False,"Wed, 04 Sep 2019 13:32:13 -0300","time.struct_time(tm_year=2019, tm_mon=9, tm_mday=4, tm_hour=16, tm_min=32, tm_sec=13, tm_wday=2, tm_yday=247, tm_isdst=0)",[{'name': 'Clarin.com'}],Clarin.com,{'name': 'Clarin.com'}
2,"Paolo Rocca: ""La gente no quiere planes, quiere empleo""","{'type': 'text/plain', 'language': None, 'base': 'https://www.clarin.com/rss/economia/', 'value': 'Paolo Rocca: ""La gente no quiere planes, quiere empleo""'}","[{'rel': 'alternate', 'type': 'text/html', 'href': 'http://www.clarin.com/economia/paolo-rocca-gente-quiere-planes-quiere-empleo-_0_-v-CLmaoF.html'}, {'length': '0', 'type': 'image/jpg', 'href': 'https://images.clarin.com/2018/12/11/HlwT22vWy_600x338__1.jpg', 'rel': 'enclosure'}]",http://www.clarin.com/economia/paolo-rocca-gente-quiere-planes-quiere-empleo-_0_-v-CLmaoF.html,"Junto con Coto, Migoya y Blaquier hablaron del futuro de las empresas en la Argentina.","{'type': 'text/html', 'language': None, 'base': 'https://www.clarin.com/rss/economia/', 'value': 'Junto con Coto, Migoya y Blaquier hablaron del futuro de las empresas en la Argentina.'}",http://www.clarin.com/economia/paolo-rocca-gente-quiere-planes-quiere-empleo-_0_-v-CLmaoF.html,False,"Wed, 04 Sep 2019 12:25:17 -0300","time.struct_time(tm_year=2019, tm_mon=9, tm_mday=4, tm_hour=15, tm_min=25, tm_sec=17, tm_wday=2, tm_yday=247, tm_isdst=0)",[{'name': 'Clarin.com'}],Clarin.com,{'name': 'Clarin.com'}
3,"Dólar hoy: a cuánto cotiza, banco por banco","{'type': 'text/plain', 'language': None, 'base': 'https://www.clarin.com/rss/economia/', 'value': 'Dólar hoy: a cuánto cotiza, banco por banco'}","[{'rel': 'alternate', 'type': 'text/html', 'href': 'http://www.clarin.com/economia/dolar-hoy-cotiza-banco-banco_0_gUBSi3Ma4.html'}, {'length': '0', 'type': 'image/jpg', 'href': 'https://images.clarin.com/2019/09/04/tLkrtDHuC_600x338__1.jpg', 'rel': 'enclosure'}]",http://www.clarin.com/economia/dolar-hoy-cotiza-banco-banco_0_gUBSi3Ma4.html,"La divisa se ubica en $ 58,30, según el relevamiento que realiza el Banco Central.","{'type': 'text/html', 'language': None, 'base': 'https://www.clarin.com/rss/economia/', 'value': 'La divisa se ubica en $ 58,30, según el relevamiento que realiza el Banco Central.'}",http://www.clarin.com/economia/dolar-hoy-cotiza-banco-banco_0_gUBSi3Ma4.html,False,"Wed, 04 Sep 2019 12:03:28 -0300","time.struct_time(tm_year=2019, tm_mon=9, tm_mday=4, tm_hour=15, tm_min=3, tm_sec=28, tm_wday=2, tm_yday=247, tm_isdst=0)",[{'name': 'Clarin.com'}],Clarin.com,{'name': 'Clarin.com'}
